,question,label
0,살인죄의 형벌은 무엇입니까?,살인죄
1,절도죄가 성립하기 위한 요건은 무엇입니까?,절도죄
2,상해죄란 무엇입니까?,상해죄
3,업무상 과실치사죄가 성립하려면 어떤 요건이 필요합니까?,과실치사죄
4,폭행죄와 상해죄의 차이는 무엇입니까?,상해죄
5,횡령죄의 주요 요건은 무엇입니까?,횡령죄
6,강도죄는 어떤 요건을 만족해야 성립합니까?,강도죄
7,특수절도죄란 무엇입니까?,절도죄
8,자수한 경우 형이 감경될 수 있습니까?,자수
9,공범은 어떤 경우에 성립합니까?,공범
10,살인미수죄의 처벌은 어떻게 됩니까?,살인죄
11,협박죄는 어떤 경우에 성립합니까?,협박죄
12,손괴죄란 무엇입니까?,손괴죄
13,강간죄는 어떤 경우에 성립합니까?,강간죄
14,사기죄의 요건은 무엇입니까?,사기죄
15,배임죄란 무엇입니까?,배임죄
16,공문서위조죄가 성립하기 위한 요건은 무엇입니까?,공문서위조죄
17,위증죄란 무엇입니까?,위증죄
18,도주죄는 어떤 경우에 성립합니까?,도주죄
19,유기죄란 무엇입니까?,유기죄
20,절도죄는 피해자의 허락이 있으면 처벌됩니다.,절도죄
21,살인죄는 피해자의 용서가 있으면 처벌되지 않습니다.,살인죄
22,상해죄는 폭행이 없으면 성립하지 않습니다.,상해죄
23,강간죄는 상대방 동의가 있어도 성립합니다.,강간죄
24,사기죄는 고의가 없어도 성립합니다.,사기죄
25,특수절도는 흉기 없이 혼자서 해야 성립합니다.,절도죄
26,공범은 형사처벌 대상이 아닙니다.,공범
27,횡령죄는 개인 소유 재산에서는 성립하지 않습니다.,횡령죄
28,모욕죄는 명예훼손이 없으면 성립하지 않습니다.,모욕죄
29,방화죄는 어떤 경우에 성립합니까?,방화죄
30,미수범은 원칙적으로 처벌되지 않는다.,미수범
31,사자의 명예를 훼손하면 명예훼손죄가 성립합니까?,명예훼손죄
32,협박죄는 반드시 재산적 손해를 끼쳐야 성립합니까?,협박죄
33,형법상 주거침입죄는 어떤 경우에 성립합니까?,주거침입죄
34,약취유인죄는 미성년자에게만 적용됩니까?,약취유인죄
35,직무유기죄란 무엇입니까?,유기죄
36,친족상도례가 적용되면 처벌을 면제할 수 있습니까?,친족상도례
37,절도범이 체포를 면하기 위해 폭행하면 강도죄가 성립합니까?,절도죄
38,기수범이 성립하려면 결과가 발생해야 합니까?,기수범
39,미필적 고의란 무엇입니까?,미필적 고의
40,강요죄는 폭행이나 협박이 수단입니까?,폭행죄
41,범죄의 성립과 처벌가 적용되는 조건은 무엇인가요?,범죄의 성립과 처벌
42,범죄의 성립과 처벌는 어떤 행위를 하면 성립하나요?,범죄의 성립과 처벌
43,범죄의 성립과 처벌가 성립하지 않는 경우도 있나요?,범죄의 성립과 처벌
44,국내범에 대한 처벌 수위는 어떻게 되나요?,국내범
45,피해자가 원하지 않아도 국내범로 처벌되나요?,국내범
46,국내범는 실수로 해도 처벌되나요?,국내범
47,내국인의 국외범에 해당하는 구체적인 예시가 있을까요?,내국인의 국외범
48,내국인의 국외범가 성립하지 않는 경우도 있나요?,내국인의 국외범
49,내국인의 국외범에 대해 설명해 주세요.,내국인의 국외범
50,국외에 있는 내국선박 등에서 외국인이 범한 죄는 실수로 해도 처벌되나요?,국외에 있는 내국선박 등에서 외국인이 범한 죄
51,피해자가 원하지 않아도 국외에 있는 내국선박 등에서 외국인이 범한 죄로 처벌되나요?,국외에 있는 내국선박 등에서 외국인이 범한 죄
52,국외에 있는 내국선박 등에서 외국인이 범한 죄에 해당하는 구체적인 예시가 있을까요?,국외에 있는 내국선박 등에서 외국인이 범한 죄
53,외국인의 국외범에 대한 처벌 수위는 어떻게 되나요?,외국인의 국외범
54,외국인의 국외범는 어떤 행위를 하면 성립하나요?,외국인의 국외범
55,외국인의 국외범가 적용되는 조건은 무엇인가요?,외국인의 국외범
56,대한민국과 대한민국국민에 대한 국외범에 대해 설명해 주세요.,대한민국과 대한민국국민에 대한 국외범
57,대한민국과 대한민국국민에 대한 국외범는 어떤 행위를 하면 성립하나요?,대한민국과 대한민국국민에 대한 국외범
58,대한민국과 대한민국국민에 대한 국외범가 성립하지 않는 경우도 있나요?,대한민국과 대한민국국민에 대한 국외범
59,외국에서 집행된 형의 산입에 대한 처벌 수위는 어떻게 되나요?,외국에서 집행된 형의 산입
60,외국에서 집행된 형의 산입는 실수로 해도 처벌되나요?,외국에서 집행된 형의 산입
61,외국에서 집행된 형의 산입가 적용되는 조건은 무엇인가요?,외국에서 집행된 형의 산입
62,총칙의 적용가 성립하지 않는 경우도 있나요?,총칙의 적용
63,피해자가 원하지 않아도 총칙의 적용로 처벌되나요?,총칙의 적용
64,총칙의 적용에 대한 처벌 수위는 어떻게 되나요?,총칙의 적용
65,형사미성년자에 대한 처벌 수위는 어떻게 되나요?,형사미성년자
66,형사미성년자는 실수로 해도 처벌되나요?,형사미성년자
67,피해자가 원하지 않아도 형사미성년자로 처벌되나요?,형사미성년자
68,심신장애인에 대한 처벌 수위는 어떻게 되나요?,심신장애인
69,심신장애인가 적용되는 조건은 무엇인가요?,심신장애인
70,심신장애인가 성립하지 않는 경우도 있나요?,심신장애인
71,청각 및 언어 장애인에 대한 처벌 수위는 어떻게 되나요?,청각 및 언어 장애인
72,피해자가 원하지 않아도 청각 및 언어 장애인로 처벌되나요?,청각 및 언어 장애인
73,청각 및 언어 장애인에 해당하는 구체적인 예시가 있을까요?,청각 및 언어 장애인
74,강요된 행위에 해당하는 구체적인 예시가 있을까요?,강요된 행위
75,강요된 행위는 실수로 해도 처벌되나요?,강요된 행위
76,강요된 행위에 대해 설명해 주세요.,강요된 행위
77,피해자가 원하지 않아도 고의로 처벌되나요?,고의
78,고의에 대한 처벌 수위는 어떻게 되나요?,고의
79,고의가 적용되는 조건은 무엇인가요?,고의
80,피해자가 원하지 않아도 과실로 처벌되나요?,과실
81,과실에 해당하는 구체적인 예시가 있을까요?,과실
82,과실는 어떤 행위를 하면 성립하나요?,과실
83,사실의 착오가 적용되는 조건은 무엇인가요?,사실의 착오
84,피해자가 원하지 않아도 사실의 착오로 처벌되나요?,사실의 착오
85,사실의 착오는 실수로 해도 처벌되나요?,사실의 착오
86,법률의 착오는 실수로 해도 처벌되나요?,법률의 착오
87,법률의 착오에 대해 설명해 주세요.,법률의 착오
88,법률의 착오는 어떤 행위를 하면 성립하나요?,법률의 착오
89,인과관계는 어떤 행위를 하면 성립하나요?,인과관계
90,인과관계가 적용되는 조건은 무엇인가요?,인과관계
91,인과관계에 대해 설명해 주세요.,인과관계
92,부작위범는 어떤 행위를 하면 성립하나요?,부작위범
93,부작위범에 해당하는 구체적인 예시가 있을까요?,부작위범
94,부작위범에 대해 설명해 주세요.,부작위범
95,독립행위의 경합가 적용되는 조건은 무엇인가요?,독립행위의 경합
96,독립행위의 경합에 대한 처벌 수위는 어떻게 되나요?,독립행위의 경합
97,독립행위의 경합는 실수로 해도 처벌되나요?,독립행위의 경합
98,정당행위에 대해 설명해 주세요.,정당행위
99,정당행위는 실수로 해도 처벌되나요?,정당행위
100,정당행위에 해당하는 구체적인 예시가 있을까요?,정당행위
101,정당방위가 성립하지 않는 경우도 있나요?,정당방위
102,정당방위가 적용되는 조건은 무엇인가요?,정당방위
103,정당방위에 대한 처벌 수위는 어떻게 되나요?,정당방위
104,긴급피난에 대한 처벌 수위는 어떻게 되나요?,긴급피난
105,긴급피난는 어떤 행위를 하면 성립하나요?,긴급피난
106,피해자가 원하지 않아도 긴급피난로 처벌되나요?,긴급피난
107,자구행위에 해당하는 구체적인 예시가 있을까요?,자구행위
108,자구행위에 대한 처벌 수위는 어떻게 되나요?,자구행위
109,자구행위는 어떤 행위를 하면 성립하나요?,자구행위
110,피해자의 승낙가 성립하지 않는 경우도 있나요?,피해자의 승낙
111,피해자의 승낙는 어떤 행위를 하면 성립하나요?,피해자의 승낙
112,피해자의 승낙는 실수로 해도 처벌되나요?,피해자의 승낙
113,미수범가 성립하지 않는 경우도 있나요?,미수범
114,미수범에 해당하는 구체적인 예시가 있을까요?,미수범
115,피해자가 원하지 않아도 미수범로 처벌되나요?,미수범
116,중지범가 성립하지 않는 경우도 있나요?,중지범
117,중지범가 적용되는 조건은 무엇인가요?,중지범
118,중지범는 실수로 해도 처벌되나요?,중지범
119,불능범가 적용되는 조건은 무엇인가요?,불능범
120,불능범가 성립하지 않는 경우도 있나요?,불능범
121,불능범에 대해 설명해 주세요.,불능범
122,"피해자가 원하지 않아도 음모, 예비로 처벌되나요?","음모, 예비"
123,"음모, 예비가 성립하지 않는 경우도 있나요?","음모, 예비"
124,"음모, 예비는 실수로 해도 처벌되나요?","음모, 예비"
125,미수범의 처벌는 어떤 행위를 하면 성립하나요?,미수범의 처벌
126,미수범의 처벌에 해당하는 구체적인 예시가 있을까요?,미수범의 처벌
127,미수범의 처벌가 성립하지 않는 경우도 있나요?,미수범의 처벌
128,공동정범에 대해 설명해 주세요.,공동정범
129,공동정범가 성립하지 않는 경우도 있나요?,공동정범
130,공동정범는 어떤 행위를 하면 성립하나요?,공동정범
131,교사범에 대한 처벌 수위는 어떻게 되나요?,교사범
132,교사범는 어떤 행위를 하면 성립하나요?,교사범
133,교사범가 적용되는 조건은 무엇인가요?,교사범
134,종범가 성립하지 않는 경우도 있나요?,종범
135,종범에 대해 설명해 주세요.,종범
136,종범는 어떤 행위를 하면 성립하나요?,종범
137,공범과 신분가 성립하지 않는 경우도 있나요?,공범과 신분
138,공범과 신분는 어떤 행위를 하면 성립하나요?,공범과 신분
139,공범과 신분에 대한 처벌 수위는 어떻게 되나요?,공범과 신분
140,"간접정범, 특수한 교사, 방조에 대한 형의 가중에 해당하는 구체적인 예시가 있을까요?","간접정범, 특수한 교사, 방조에 대한 형의 가중"
141,"간접정범, 특수한 교사, 방조에 대한 형의 가중가 적용되는 조건은 무엇인가요?","간접정범, 특수한 교사, 방조에 대한 형의 가중"
142,"간접정범, 특수한 교사, 방조에 대한 형의 가중가 성립하지 않는 경우도 있나요?","간접정범, 특수한 교사, 방조에 대한 형의 가중"
143,누범가 적용되는 조건은 무엇인가요?,누범
144,피해자가 원하지 않아도 누범로 처벌되나요?,누범
145,누범는 어떤 행위를 하면 성립하나요?,누범
146,판결선고후의 누범발각는 실수로 해도 처벌되나요?,판결선고후의 누범발각
147,판결선고후의 누범발각는 어떤 행위를 하면 성립하나요?,판결선고후의 누범발각
148,판결선고후의 누범발각에 대한 처벌 수위는 어떻게 되나요?,판결선고후의 누범발각
149,경합범는 어떤 행위를 하면 성립하나요?,경합범
150,경합범는 실수로 해도 처벌되나요?,경합범
151,경합범가 적용되는 조건은 무엇인가요?,경합범
152,경합범과 처벌례에 해당하는 구체적인 예시가 있을까요?,경합범과 처벌례
153,피해자가 원하지 않아도 경합범과 처벌례로 처벌되나요?,경합범과 처벌례
154,경합범과 처벌례는 어떤 행위를 하면 성립하나요?,경합범과 처벌례
155,"판결을 받지 아니한 경합범, 수개의 판결과 경합범, 형의 집행과 경합범에 해당하는 구체적인 예시가 있을까요?","판결을 받지 아니한 경합범, 수개의 판결과 경합범, 형의 집행과 경합범"
156,"피해자가 원하지 않아도 판결을 받지 아니한 경합범, 수개의 판결과 경합범, 형의 집행과 경합범로 처벌되나요?","판결을 받지 아니한 경합범, 수개의 판결과 경합범, 형의 집행과 경합범"
157,"판결을 받지 아니한 경합범, 수개의 판결과 경합범, 형의 집행과 경합범는 어떤 행위를 하면 성립하나요?","판결을 받지 아니한 경합범, 수개의 판결과 경합범, 형의 집행과 경합범"
158,상상적 경합는 어떤 행위를 하면 성립하나요?,상상적 경합
159,상상적 경합가 적용되는 조건은 무엇인가요?,상상적 경합
160,피해자가 원하지 않아도 상상적 경합로 처벌되나요?,상상적 경합
161,형의 종류는 어떤 행위를 하면 성립하나요?,형의 종류
162,형의 종류에 대해 설명해 주세요.,형의 종류
163,피해자가 원하지 않아도 형의 종류로 처벌되나요?,형의 종류
164,징역 또는 금고의 기간가 성립하지 않는 경우도 있나요?,징역 또는 금고의 기간
165,징역 또는 금고의 기간는 어떤 행위를 하면 성립하나요?,징역 또는 금고의 기간
166,피해자가 원하지 않아도 징역 또는 금고의 기간로 처벌되나요?,징역 또는 금고의 기간
167,"형의 선고와 자격상실, 자격정지에 대해 설명해 주세요.","형의 선고와 자격상실, 자격정지"
168,"형의 선고와 자격상실, 자격정지는 어떤 행위를 하면 성립하나요?","형의 선고와 자격상실, 자격정지"
169,"형의 선고와 자격상실, 자격정지에 해당하는 구체적인 예시가 있을까요?","형의 선고와 자격상실, 자격정지"
170,자격정지가 적용되는 조건은 무엇인가요?,자격정지
171,자격정지에 대한 처벌 수위는 어떻게 되나요?,자격정지
172,자격정지는 실수로 해도 처벌되나요?,자격정지
173,피해자가 원하지 않아도 벌금로 처벌되나요?,벌금
174,벌금에 해당하는 구체적인 예시가 있을까요?,벌금
175,벌금는 실수로 해도 처벌되나요?,벌금
176,구류에 대해 설명해 주세요.,구류
177,구류에 해당하는 구체적인 예시가 있을까요?,구류
178,구류는 어떤 행위를 하면 성립하나요?,구류
179,과료에 대한 처벌 수위는 어떻게 되나요?,과료
180,과료에 대해 설명해 주세요.,과료
181,피해자가 원하지 않아도 과료로 처벌되나요?,과료
182,몰수의 대상과 추징가 성립하지 않는 경우도 있나요?,몰수의 대상과 추징
183,몰수의 대상과 추징에 해당하는 구체적인 예시가 있을까요?,몰수의 대상과 추징
184,몰수의 대상과 추징는 실수로 해도 처벌되나요?,몰수의 대상과 추징
185,몰수의 부가성에 해당하는 구체적인 예시가 있을까요?,몰수의 부가성
186,피해자가 원하지 않아도 몰수의 부가성로 처벌되나요?,몰수의 부가성
187,몰수의 부가성는 어떤 행위를 하면 성립하나요?,몰수의 부가성
188,형의 경중가 적용되는 조건은 무엇인가요?,형의 경중
189,형의 경중가 성립하지 않는 경우도 있나요?,형의 경중
190,형의 경중는 실수로 해도 처벌되나요?,형의 경중
191,양형의 조건는 어떤 행위를 하면 성립하나요?,양형의 조건
192,피해자가 원하지 않아도 양형의 조건로 처벌되나요?,양형의 조건
193,양형의 조건는 실수로 해도 처벌되나요?,양형의 조건
194,"자수, 자복는 실수로 해도 처벌되나요?","자수, 자복"
195,"자수, 자복에 대한 처벌 수위는 어떻게 되나요?","자수, 자복"
196,"자수, 자복가 성립하지 않는 경우도 있나요?","자수, 자복"
197,정상참작감경는 실수로 해도 처벌되나요?,정상참작감경
198,정상참작감경가 적용되는 조건은 무엇인가요?,정상참작감경
199,정상참작감경는 어떤 행위를 하면 성립하나요?,정상참작감경
200,선택형과 정상참작감경는 어떤 행위를 하면 성립하나요?,선택형과 정상참작감경
201,선택형과 정상참작감경가 성립하지 않는 경우도 있나요?,선택형과 정상참작감경
202,피해자가 원하지 않아도 선택형과 정상참작감경로 처벌되나요?,선택형과 정상참작감경
203,법률상의 감경에 대한 처벌 수위는 어떻게 되나요?,법률상의 감경
204,법률상의 감경에 해당하는 구체적인 예시가 있을까요?,법률상의 감경
205,피해자가 원하지 않아도 법률상의 감경로 처벌되나요?,법률상의 감경
206,가중ㆍ감경의 순서는 어떤 행위를 하면 성립하나요?,가중ㆍ감경의 순서
207,가중ㆍ감경의 순서에 대한 처벌 수위는 어떻게 되나요?,가중ㆍ감경의 순서
208,가중ㆍ감경의 순서는 실수로 해도 처벌되나요?,가중ㆍ감경의 순서
209,판결선고전 구금일수의 통산는 어떤 행위를 하면 성립하나요?,판결선고전 구금일수의 통산
210,판결선고전 구금일수의 통산에 해당하는 구체적인 예시가 있을까요?,판결선고전 구금일수의 통산
211,판결선고전 구금일수의 통산는 실수로 해도 처벌되나요?,판결선고전 구금일수의 통산
212,판결의 공시가 성립하지 않는 경우도 있나요?,판결의 공시
213,판결의 공시는 어떤 행위를 하면 성립하나요?,판결의 공시
214,판결의 공시에 해당하는 구체적인 예시가 있을까요?,판결의 공시
215,선고유예의 요건에 대한 처벌 수위는 어떻게 되나요?,선고유예의 요건
216,선고유예의 요건는 어떤 행위를 하면 성립하나요?,선고유예의 요건
217,피해자가 원하지 않아도 선고유예의 요건로 처벌되나요?,선고유예의 요건
218,선고유예의 효과가 성립하지 않는 경우도 있나요?,선고유예의 효과
219,선고유예의 효과에 대한 처벌 수위는 어떻게 되나요?,선고유예의 효과
220,선고유예의 효과는 어떤 행위를 하면 성립하나요?,선고유예의 효과
221,피해자가 원하지 않아도 선고유예의 실효로 처벌되나요?,선고유예의 실효
222,선고유예의 실효에 해당하는 구체적인 예시가 있을까요?,선고유예의 실효
223,선고유예의 실효는 실수로 해도 처벌되나요?,선고유예의 실효
224,피해자가 원하지 않아도 집행유예의 요건로 처벌되나요?,집행유예의 요건
225,집행유예의 요건가 성립하지 않는 경우도 있나요?,집행유예의 요건
226,집행유예의 요건에 대해 설명해 주세요.,집행유예의 요건
227,피해자가 원하지 않아도 집행유예의 실효로 처벌되나요?,집행유예의 실효
228,집행유예의 실효가 성립하지 않는 경우도 있나요?,집행유예의 실효
229,집행유예의 실효에 대한 처벌 수위는 어떻게 되나요?,집행유예의 실효
230,집행유예의 취소에 대한 처벌 수위는 어떻게 되나요?,집행유예의 취소
231,집행유예의 취소는 실수로 해도 처벌되나요?,집행유예의 취소
232,집행유예의 취소에 대해 설명해 주세요.,집행유예의 취소
233,집행유예의 효과에 해당하는 구체적인 예시가 있을까요?,집행유예의 효과
234,집행유예의 효과에 대해 설명해 주세요.,집행유예의 효과
235,집행유예의 효과가 적용되는 조건은 무엇인가요?,집행유예의 효과
236,사형가 적용되는 조건은 무엇인가요?,사형
237,피해자가 원하지 않아도 사형로 처벌되나요?,사형
238,사형에 대해 설명해 주세요.,사형
239,징역에 해당하는 구체적인 예시가 있을까요?,징역
240,징역가 적용되는 조건은 무엇인가요?,징역
241,징역에 대한 처벌 수위는 어떻게 되나요?,징역
242,금고와 구류는 실수로 해도 처벌되나요?,금고와 구류
243,금고와 구류에 대한 처벌 수위는 어떻게 되나요?,금고와 구류
244,피해자가 원하지 않아도 금고와 구류로 처벌되나요?,금고와 구류
245,벌금과 과료에 대해 설명해 주세요.,벌금과 과료
246,벌금과 과료는 어떤 행위를 하면 성립하나요?,벌금과 과료
247,벌금과 과료에 대한 처벌 수위는 어떻게 되나요?,벌금과 과료
248,노역장 유치는 어떤 행위를 하면 성립하나요?,노역장 유치
249,노역장 유치가 적용되는 조건은 무엇인가요?,노역장 유치
250,노역장 유치가 성립하지 않는 경우도 있나요?,노역장 유치
251,유치일수의 공제는 실수로 해도 처벌되나요?,유치일수의 공제
252,유치일수의 공제는 어떤 행위를 하면 성립하나요?,유치일수의 공제
253,유치일수의 공제가 적용되는 조건은 무엇인가요?,유치일수의 공제
254,가석방의 요건는 어떤 행위를 하면 성립하나요?,가석방의 요건
255,가석방의 요건에 대한 처벌 수위는 어떻게 되나요?,가석방의 요건
256,가석방의 요건가 적용되는 조건은 무엇인가요?,가석방의 요건
257,판결선고 전 구금과 가석방에 해당하는 구체적인 예시가 있을까요?,판결선고 전 구금과 가석방
258,판결선고 전 구금과 가석방에 대해 설명해 주세요.,판결선고 전 구금과 가석방
259,판결선고 전 구금과 가석방가 성립하지 않는 경우도 있나요?,판결선고 전 구금과 가석방
260,가석방의 실효에 해당하는 구체적인 예시가 있을까요?,가석방의 실효
261,가석방의 실효에 대한 처벌 수위는 어떻게 되나요?,가석방의 실효
262,가석방의 실효는 어떤 행위를 하면 성립하나요?,가석방의 실효
263,가석방의 취소는 어떤 행위를 하면 성립하나요?,가석방의 취소
264,피해자가 원하지 않아도 가석방의 취소로 처벌되나요?,가석방의 취소
265,가석방의 취소에 해당하는 구체적인 예시가 있을까요?,가석방의 취소
266,가석방의 효과가 적용되는 조건은 무엇인가요?,가석방의 효과
267,가석방의 효과에 해당하는 구체적인 예시가 있을까요?,가석방의 효과
268,가석방의 효과가 성립하지 않는 경우도 있나요?,가석방의 효과
269,피해자가 원하지 않아도 형의 시효의 효과로 처벌되나요?,형의 시효의 효과
270,형의 시효의 효과는 어떤 행위를 하면 성립하나요?,형의 시효의 효과
271,형의 시효의 효과에 해당하는 구체적인 예시가 있을까요?,형의 시효의 효과
272,형의 시효의 기간는 어떤 행위를 하면 성립하나요?,형의 시효의 기간
273,형의 시효의 기간에 대한 처벌 수위는 어떻게 되나요?,형의 시효의 기간
274,형의 시효의 기간에 해당하는 구체적인 예시가 있을까요?,형의 시효의 기간
275,형의 시효의 정지가 적용되는 조건은 무엇인가요?,형의 시효의 정지
276,형의 시효의 정지에 대한 처벌 수위는 어떻게 되나요?,형의 시효의 정지
277,형의 시효의 정지는 어떤 행위를 하면 성립하나요?,형의 시효의 정지
278,형의 시효의 중단가 성립하지 않는 경우도 있나요?,형의 시효의 중단
279,형의 시효의 중단에 대해 설명해 주세요.,형의 시효의 중단
280,형의 시효의 중단가 적용되는 조건은 무엇인가요?,형의 시효의 중단
281,피해자가 원하지 않아도 형의 실효로 처벌되나요?,형의 실효
282,형의 실효가 적용되는 조건은 무엇인가요?,형의 실효
283,형의 실효는 어떤 행위를 하면 성립하나요?,형의 실효
284,복권가 성립하지 않는 경우도 있나요?,복권
285,복권는 실수로 해도 처벌되나요?,복권
286,복권에 대해 설명해 주세요.,복권
287,기간의 계산에 해당하는 구체적인 예시가 있을까요?,기간의 계산
288,기간의 계산에 대해 설명해 주세요.,기간의 계산
289,기간의 계산에 대한 처벌 수위는 어떻게 되나요?,기간의 계산
290,피해자가 원하지 않아도 형기의 기산로 처벌되나요?,형기의 기산
291,형기의 기산는 실수로 해도 처벌되나요?,형기의 기산
292,형기의 기산가 성립하지 않는 경우도 있나요?,형기의 기산
293,형의 집행과 시효기간의 초일에 해당하는 구체적인 예시가 있을까요?,형의 집행과 시효기간의 초일
294,형의 집행과 시효기간의 초일는 어떤 행위를 하면 성립하나요?,형의 집행과 시효기간의 초일
295,형의 집행과 시효기간의 초일에 대한 처벌 수위는 어떻게 되나요?,형의 집행과 시효기간의 초일
