,question,label
597,"기차, 선박 등의 교통방해가 적용되는 조건은 무엇인가요?","기차, 선박 등의 교통방해"
598,"기차, 선박 등의 교통방해에 해당하는 구체적인 예시가 있을까요?","기차, 선박 등의 교통방해"
599,기차 등의 전복 등가 적용되는 조건은 무엇인가요?,기차 등의 전복 등
600,기차 등의 전복 등에 대해 설명해 주세요.,기차 등의 전복 등
601,기차 등의 전복 등는 어떤 행위를 하면 성립하나요?,기차 등의 전복 등
602,교통방해치사상가 적용되는 조건은 무엇인가요?,교통방해치사상
603,교통방해치사상는 어떤 행위를 하면 성립하나요?,교통방해치사상
604,피해자가 원하지 않아도 교통방해치사상로 처벌되나요?,교통방해치사상
605,"과실, 업무상과실, 중과실는 실수로 해도 처벌되나요?","과실, 업무상과실, 중과실"
606,"과실, 업무상과실, 중과실가 적용되는 조건은 무엇인가요?","과실, 업무상과실, 중과실"
607,"과실, 업무상과실, 중과실에 해당하는 구체적인 예시가 있을까요?","과실, 업무상과실, 중과실"
614,먹는 물의 사용방해가 성립하지 않는 경우도 있나요?,먹는 물의 사용방해
615,먹는 물의 사용방해가 적용되는 조건은 무엇인가요?,먹는 물의 사용방해
616,먹는 물의 사용방해에 대한 처벌 수위는 어떻게 되나요?,먹는 물의 사용방해
617,피해자가 원하지 않아도 수돗물의 사용방해로 처벌되나요?,수돗물의 사용방해
618,수돗물의 사용방해는 실수로 해도 처벌되나요?,수돗물의 사용방해
619,수돗물의 사용방해가 성립하지 않는 경우도 있나요?,수돗물의 사용방해
620,먹는 물 혼독치사상에 해당하는 구체적인 예시가 있을까요?,먹는 물 혼독치사상
621,먹는 물 혼독치사상에 대한 처벌 수위는 어떻게 되나요?,먹는 물 혼독치사상
622,먹는 물 혼독치사상에 대해 설명해 주세요.,먹는 물 혼독치사상
623,수도불통는 실수로 해도 처벌되나요?,수도불통
624,수도불통가 적용되는 조건은 무엇인가요?,수도불통
625,수도불통에 대해 설명해 주세요.,수도불통
631,"예비, 음모에 해당하는 구체적인 예시가 있을까요?","예비, 음모"
632,피해자가 원하지 않아도 아편 등의 제조 등로 처벌되나요?,아편 등의 제조 등
633,아편 등의 제조 등는 실수로 해도 처벌되나요?,아편 등의 제조 등
634,아편 등의 제조 등에 해당하는 구체적인 예시가 있을까요?,아편 등의 제조 등
635,아편흡식기의 제조 등에 대한 처벌 수위는 어떻게 되나요?,아편흡식기의 제조 등
636,아편흡식기의 제조 등는 실수로 해도 처벌되나요?,아편흡식기의 제조 등
637,피해자가 원하지 않아도 아편흡식기의 제조 등로 처벌되나요?,아편흡식기의 제조 등
638,피해자가 원하지 않아도 세관 공무원의 아편 등의 수입로 처벌되나요?,세관 공무원의 아편 등의 수입
639,세관 공무원의 아편 등의 수입에 해당하는 구체적인 예시가 있을까요?,세관 공무원의 아편 등의 수입
640,세관 공무원의 아편 등의 수입에 대한 처벌 수위는 어떻게 되나요?,세관 공무원의 아편 등의 수입
641,"피해자가 원하지 않아도 아편흡식 등, 동장소제공로 처벌되나요?","아편흡식 등, 동장소제공"
642,"아편흡식 등, 동장소제공는 어떤 행위를 하면 성립하나요?","아편흡식 등, 동장소제공"
643,"아편흡식 등, 동장소제공가 적용되는 조건은 무엇인가요?","아편흡식 등, 동장소제공"
647,상습범는 어떤 행위를 하면 성립하나요?,상습범
648,상습범에 해당하는 구체적인 예시가 있을까요?,상습범
649,상습범가 성립하지 않는 경우도 있나요?,상습범
650,자격정지 또는 벌금의 병과가 적용되는 조건은 무엇인가요?,자격정지 또는 벌금의 병과
651,자격정지 또는 벌금의 병과는 어떤 행위를 하면 성립하나요?,자격정지 또는 벌금의 병과
652,자격정지 또는 벌금의 병과가 성립하지 않는 경우도 있나요?,자격정지 또는 벌금의 병과
653,아편 등의 소지에 대한 처벌 수위는 어떻게 되나요?,아편 등의 소지
654,피해자가 원하지 않아도 아편 등의 소지로 처벌되나요?,아편 등의 소지
655,아편 등의 소지가 성립하지 않는 경우도 있나요?,아편 등의 소지
656,"몰수, 추징에 대해 설명해 주세요.","몰수, 추징"
658,"몰수, 추징에 해당하는 구체적인 예시가 있을까요?","몰수, 추징"
659,통화의 위조 등에 대한 처벌 수위는 어떻게 되나요?,통화의 위조 등
660,피해자가 원하지 않아도 통화의 위조 등로 처벌되나요?,통화의 위조 등
661,통화의 위조 등가 성립하지 않는 경우도 있나요?,통화의 위조 등
662,위조통화의 취득에 대해 설명해 주세요.,위조통화의 취득
663,위조통화의 취득에 대한 처벌 수위는 어떻게 되나요?,위조통화의 취득
664,위조통화의 취득에 해당하는 구체적인 예시가 있을까요?,위조통화의 취득
665,자격정지 또는 벌금의 병과에 대한 처벌 수위는 어떻게 되나요?,자격정지 또는 벌금의 병과
667,자격정지 또는 벌금의 병과에 대해 설명해 주세요.,자격정지 또는 벌금의 병과
668,위조통화 취득 후의 지정행사가 성립하지 않는 경우도 있나요?,위조통화 취득 후의 지정행사
669,위조통화 취득 후의 지정행사에 해당하는 구체적인 예시가 있을까요?,위조통화 취득 후의 지정행사
670,위조통화 취득 후의 지정행사에 대한 처벌 수위는 어떻게 되나요?,위조통화 취득 후의 지정행사
671,통화유사물의 제조 등가 적용되는 조건은 무엇인가요?,통화유사물의 제조 등
672,통화유사물의 제조 등에 대한 처벌 수위는 어떻게 되나요?,통화유사물의 제조 등
673,통화유사물의 제조 등는 실수로 해도 처벌되나요?,통화유사물의 제조 등
680,유가증권의 위조 등는 어떤 행위를 하면 성립하나요?,유가증권의 위조 등
681,유가증권의 위조 등는 실수로 해도 처벌되나요?,유가증권의 위조 등
682,유가증권의 위조 등가 성립하지 않는 경우도 있나요?,유가증권의 위조 등
683,자격모용에 의한 유가증권의 작성가 적용되는 조건은 무엇인가요?,자격모용에 의한 유가증권의 작성
684,자격모용에 의한 유가증권의 작성는 실수로 해도 처벌되나요?,자격모용에 의한 유가증권의 작성
685,자격모용에 의한 유가증권의 작성에 대한 처벌 수위는 어떻게 되나요?,자격모용에 의한 유가증권의 작성
686,허위유가증권의 작성 등가 성립하지 않는 경우도 있나요?,허위유가증권의 작성 등
687,허위유가증권의 작성 등에 해당하는 구체적인 예시가 있을까요?,허위유가증권의 작성 등
688,허위유가증권의 작성 등에 대한 처벌 수위는 어떻게 되나요?,허위유가증권의 작성 등
689,피해자가 원하지 않아도 위조유가증권 등의 행사 등로 처벌되나요?,위조유가증권 등의 행사 등
690,위조유가증권 등의 행사 등에 대해 설명해 주세요.,위조유가증권 등의 행사 등
691,위조유가증권 등의 행사 등는 어떤 행위를 하면 성립하나요?,위조유가증권 등의 행사 등
692,인지ㆍ우표의 위조등가 성립하지 않는 경우도 있나요?,인지ㆍ우표의 위조등
693,인지ㆍ우표의 위조등에 해당하는 구체적인 예시가 있을까요?,인지ㆍ우표의 위조등
694,피해자가 원하지 않아도 인지ㆍ우표의 위조등로 처벌되나요?,인지ㆍ우표의 위조등
695,위조인지ㆍ우표등의 취득에 해당하는 구체적인 예시가 있을까요?,위조인지ㆍ우표등의 취득
696,위조인지ㆍ우표등의 취득에 대한 처벌 수위는 어떻게 되나요?,위조인지ㆍ우표등의 취득
697,위조인지ㆍ우표등의 취득에 대해 설명해 주세요.,위조인지ㆍ우표등의 취득
698,피해자가 원하지 않아도 자격정지 또는 벌금의 병과로 처벌되나요?,자격정지 또는 벌금의 병과
701,소인말소에 대해 설명해 주세요.,소인말소
702,소인말소가 성립하지 않는 경우도 있나요?,소인말소
703,피해자가 원하지 않아도 소인말소로 처벌되나요?,소인말소
704,피해자가 원하지 않아도 인지ㆍ우표유사물의 제조 등로 처벌되나요?,인지ㆍ우표유사물의 제조 등
705,인지ㆍ우표유사물의 제조 등는 어떤 행위를 하면 성립하나요?,인지ㆍ우표유사물의 제조 등
706,인지ㆍ우표유사물의 제조 등에 해당하는 구체적인 예시가 있을까요?,인지ㆍ우표유사물의 제조 등
713,공문서등의 위조ㆍ변조는 어떤 행위를 하면 성립하나요?,공문서등의 위조ㆍ변조
714,공문서등의 위조ㆍ변조에 대한 처벌 수위는 어떻게 되나요?,공문서등의 위조ㆍ변조
715,공문서등의 위조ㆍ변조가 적용되는 조건은 무엇인가요?,공문서등의 위조ㆍ변조
716,자격모용에 의한 공문서 등의 작성는 어떤 행위를 하면 성립하나요?,자격모용에 의한 공문서 등의 작성
717,자격모용에 의한 공문서 등의 작성가 성립하지 않는 경우도 있나요?,자격모용에 의한 공문서 등의 작성
718,자격모용에 의한 공문서 등의 작성에 대한 처벌 수위는 어떻게 되나요?,자격모용에 의한 공문서 등의 작성
719,허위공문서작성등가 적용되는 조건은 무엇인가요?,허위공문서작성등
720,허위공문서작성등에 해당하는 구체적인 예시가 있을까요?,허위공문서작성등
721,허위공문서작성등는 어떤 행위를 하면 성립하나요?,허위공문서작성등
722,공정증서원본 등의 부실기재에 대해 설명해 주세요.,공정증서원본 등의 부실기재
723,공정증서원본 등의 부실기재는 어떤 행위를 하면 성립하나요?,공정증서원본 등의 부실기재
724,피해자가 원하지 않아도 공정증서원본 등의 부실기재로 처벌되나요?,공정증서원본 등의 부실기재
725,위조등 공문서의 행사에 대해 설명해 주세요.,위조등 공문서의 행사
726,위조등 공문서의 행사에 대한 처벌 수위는 어떻게 되나요?,위조등 공문서의 행사
727,위조등 공문서의 행사에 해당하는 구체적인 예시가 있을까요?,위조등 공문서의 행사
728,공문서 등의 부정행사가 성립하지 않는 경우도 있나요?,공문서 등의 부정행사
729,공문서 등의 부정행사에 대한 처벌 수위는 어떻게 되나요?,공문서 등의 부정행사
730,피해자가 원하지 않아도 공문서 등의 부정행사로 처벌되나요?,공문서 등의 부정행사
731,사문서등의 위조ㆍ변조에 대해 설명해 주세요.,사문서등의 위조ㆍ변조
732,사문서등의 위조ㆍ변조에 대한 처벌 수위는 어떻게 되나요?,사문서등의 위조ㆍ변조
733,사문서등의 위조ㆍ변조는 실수로 해도 처벌되나요?,사문서등의 위조ㆍ변조
734,자격모용에 의한 사문서의 작성는 어떤 행위를 하면 성립하나요?,자격모용에 의한 사문서의 작성
735,피해자가 원하지 않아도 자격모용에 의한 사문서의 작성로 처벌되나요?,자격모용에 의한 사문서의 작성
736,자격모용에 의한 사문서의 작성에 대한 처벌 수위는 어떻게 되나요?,자격모용에 의한 사문서의 작성
737,허위진단서등의 작성는 어떤 행위를 하면 성립하나요?,허위진단서등의 작성
738,허위진단서등의 작성가 성립하지 않는 경우도 있나요?,허위진단서등의 작성
739,허위진단서등의 작성는 실수로 해도 처벌되나요?,허위진단서등의 작성
740,피해자가 원하지 않아도 위조사문서등의 행사로 처벌되나요?,위조사문서등의 행사
741,위조사문서등의 행사는 실수로 해도 처벌되나요?,위조사문서등의 행사
742,위조사문서등의 행사가 성립하지 않는 경우도 있나요?,위조사문서등의 행사
746,사문서의 부정행사에 대해 설명해 주세요.,사문서의 부정행사
747,사문서의 부정행사에 해당하는 구체적인 예시가 있을까요?,사문서의 부정행사
748,사문서의 부정행사는 실수로 해도 처벌되나요?,사문서의 부정행사
749,피해자가 원하지 않아도 자격정지의 병과로 처벌되나요?,자격정지의 병과
750,자격정지의 병과에 해당하는 구체적인 예시가 있을까요?,자격정지의 병과
751,자격정지의 병과가 적용되는 조건은 무엇인가요?,자격정지의 병과
752,"공인 등의 위조, 부정사용는 실수로 해도 처벌되나요?","공인 등의 위조, 부정사용"
753,"공인 등의 위조, 부정사용가 적용되는 조건은 무엇인가요?","공인 등의 위조, 부정사용"
754,"공인 등의 위조, 부정사용에 대한 처벌 수위는 어떻게 되나요?","공인 등의 위조, 부정사용"
755,"사인등의 위조, 부정사용가 성립하지 않는 경우도 있나요?","사인등의 위조, 부정사용"
756,"사인등의 위조, 부정사용에 해당하는 구체적인 예시가 있을까요?","사인등의 위조, 부정사용"
757,"피해자가 원하지 않아도 사인등의 위조, 부정사용로 처벌되나요?","사인등의 위조, 부정사용"
761,음행매개가 성립하지 않는 경우도 있나요?,음행매개
762,피해자가 원하지 않아도 음행매개로 처벌되나요?,음행매개
763,음행매개가 적용되는 조건은 무엇인가요?,음행매개
764,음화반포등는 실수로 해도 처벌되나요?,음화반포등
765,음화반포등가 적용되는 조건은 무엇인가요?,음화반포등
766,음화반포등가 성립하지 않는 경우도 있나요?,음화반포등
767,음화제조 등에 대해 설명해 주세요.,음화제조 등
768,음화제조 등는 어떤 행위를 하면 성립하나요?,음화제조 등
769,음화제조 등가 적용되는 조건은 무엇인가요?,음화제조 등
770,피해자가 원하지 않아도 공연음란로 처벌되나요?,공연음란
771,공연음란에 해당하는 구체적인 예시가 있을까요?,공연음란
772,공연음란는 실수로 해도 처벌되나요?,공연음란
773,"도박, 상습도박가 적용되는 조건은 무엇인가요?","도박, 상습도박"
774,"도박, 상습도박는 어떤 행위를 하면 성립하나요?","도박, 상습도박"
775,"도박, 상습도박는 실수로 해도 처벌되나요?","도박, 상습도박"
776,도박장소 등 개설가 적용되는 조건은 무엇인가요?,도박장소 등 개설
777,도박장소 등 개설는 어떤 행위를 하면 성립하나요?,도박장소 등 개설
778,도박장소 등 개설에 대해 설명해 주세요.,도박장소 등 개설
779,복표의 발매 등는 어떤 행위를 하면 성립하나요?,복표의 발매 등
780,복표의 발매 등가 적용되는 조건은 무엇인가요?,복표의 발매 등
781,복표의 발매 등에 대한 처벌 수위는 어떻게 되나요?,복표의 발매 등
782,벌금의 병과에 대해 설명해 주세요.,벌금의 병과
783,벌금의 병과는 실수로 해도 처벌되나요?,벌금의 병과
784,벌금의 병과가 적용되는 조건은 무엇인가요?,벌금의 병과
785,"살인, 존속살해는 어떤 행위를 하면 성립하나요?","살인, 존속살해"
786,"살인, 존속살해에 대한 처벌 수위는 어떻게 되나요?","살인, 존속살해"
787,"살인, 존속살해는 실수로 해도 처벌되나요?","살인, 존속살해"
788,"촉탁, 승낙에 의한 살인 등는 어떤 행위를 하면 성립하나요?","촉탁, 승낙에 의한 살인 등"
789,"촉탁, 승낙에 의한 살인 등가 성립하지 않는 경우도 있나요?","촉탁, 승낙에 의한 살인 등"
790,"촉탁, 승낙에 의한 살인 등에 대해 설명해 주세요.","촉탁, 승낙에 의한 살인 등"
791,위계 등에 의한 촉탁살인 등에 대한 처벌 수위는 어떻게 되나요?,위계 등에 의한 촉탁살인 등
792,위계 등에 의한 촉탁살인 등에 해당하는 구체적인 예시가 있을까요?,위계 등에 의한 촉탁살인 등
793,위계 등에 의한 촉탁살인 등가 적용되는 조건은 무엇인가요?,위계 등에 의한 촉탁살인 등
798,"예비, 음모에 대해 설명해 주세요.","예비, 음모"
799,"예비, 음모에 대한 처벌 수위는 어떻게 되나요?","예비, 음모"
801,자격정지의 병과가 성립하지 않는 경우도 있나요?,자격정지의 병과
803,"상해, 존속상해에 해당하는 구체적인 예시가 있을까요?","상해, 존속상해"
804,"상해, 존속상해가 성립하지 않는 경우도 있나요?","상해, 존속상해"
805,"상해, 존속상해에 대한 처벌 수위는 어떻게 되나요?","상해, 존속상해"
806,"중상해, 존속중상해가 성립하지 않는 경우도 있나요?","중상해, 존속중상해"
807,"중상해, 존속중상해는 어떤 행위를 하면 성립하나요?","중상해, 존속중상해"
808,"중상해, 존속중상해는 실수로 해도 처벌되나요?","중상해, 존속중상해"
809,상해치사가 성립하지 않는 경우도 있나요?,상해치사
810,상해치사가 적용되는 조건은 무엇인가요?,상해치사
811,상해치사에 대한 처벌 수위는 어떻게 되나요?,상해치사
812,"폭행, 존속폭행가 적용되는 조건은 무엇인가요?","폭행, 존속폭행"
813,"폭행, 존속폭행에 대한 처벌 수위는 어떻게 되나요?","폭행, 존속폭행"
814,"폭행, 존속폭행는 어떤 행위를 하면 성립하나요?","폭행, 존속폭행"
815,특수폭행에 대해 설명해 주세요.,특수폭행
816,특수폭행는 실수로 해도 처벌되나요?,특수폭행
817,특수폭행가 적용되는 조건은 무엇인가요?,특수폭행
818,피해자가 원하지 않아도 폭행치사상로 처벌되나요?,폭행치사상
819,폭행치사상에 대한 처벌 수위는 어떻게 되나요?,폭행치사상
820,폭행치사상가 적용되는 조건은 무엇인가요?,폭행치사상
821,동시범에 대한 처벌 수위는 어떻게 되나요?,동시범
822,동시범가 성립하지 않는 경우도 있나요?,동시범
823,동시범는 어떤 행위를 하면 성립하나요?,동시범
825,상습범가 적용되는 조건은 무엇인가요?,상습범
826,상습범는 실수로 해도 처벌되나요?,상습범
829,자격정지의 병과는 어떤 행위를 하면 성립하나요?,자격정지의 병과
830,피해자가 원하지 않아도 과실치상로 처벌되나요?,과실치상
831,과실치상에 대해 설명해 주세요.,과실치상
832,과실치상는 실수로 해도 처벌되나요?,과실치상
833,과실치사가 성립하지 않는 경우도 있나요?,과실치사
834,과실치사가 적용되는 조건은 무엇인가요?,과실치사
835,과실치사에 대해 설명해 주세요.,과실치사
836,업무상과실ㆍ중과실 치사상가 적용되는 조건은 무엇인가요?,업무상과실ㆍ중과실 치사상
837,피해자가 원하지 않아도 업무상과실ㆍ중과실 치사상로 처벌되나요?,업무상과실ㆍ중과실 치사상
838,업무상과실ㆍ중과실 치사상에 해당하는 구체적인 예시가 있을까요?,업무상과실ㆍ중과실 치사상
839,낙태에 대해 설명해 주세요.,낙태
840,낙태에 대한 처벌 수위는 어떻게 되나요?,낙태
841,낙태는 실수로 해도 처벌되나요?,낙태
842,"의사 등의 낙태, 부동의낙태가 적용되는 조건은 무엇인가요?","의사 등의 낙태, 부동의낙태"
843,"의사 등의 낙태, 부동의낙태는 어떤 행위를 하면 성립하나요?","의사 등의 낙태, 부동의낙태"
844,"의사 등의 낙태, 부동의낙태에 대한 처벌 수위는 어떻게 되나요?","의사 등의 낙태, 부동의낙태"
845,"유기, 존속유기는 실수로 해도 처벌되나요?","유기, 존속유기"
846,"유기, 존속유기에 대한 처벌 수위는 어떻게 되나요?","유기, 존속유기"
847,"유기, 존속유기는 어떤 행위를 하면 성립하나요?","유기, 존속유기"
848,"학대, 존속학대가 성립하지 않는 경우도 있나요?","학대, 존속학대"
849,"학대, 존속학대는 어떤 행위를 하면 성립하나요?","학대, 존속학대"
850,"학대, 존속학대가 적용되는 조건은 무엇인가요?","학대, 존속학대"
851,아동혹사에 해당하는 구체적인 예시가 있을까요?,아동혹사
852,아동혹사에 대한 처벌 수위는 어떻게 되나요?,아동혹사
853,아동혹사에 대해 설명해 주세요.,아동혹사
854,유기등 치사상는 실수로 해도 처벌되나요?,유기등 치사상
855,유기등 치사상에 대한 처벌 수위는 어떻게 되나요?,유기등 치사상
856,유기등 치사상가 성립하지 않는 경우도 있나요?,유기등 치사상
857,"체포, 감금, 존속체포, 존속감금는 실수로 해도 처벌되나요?","체포, 감금, 존속체포, 존속감금"
858,"체포, 감금, 존속체포, 존속감금가 적용되는 조건은 무엇인가요?","체포, 감금, 존속체포, 존속감금"
859,"체포, 감금, 존속체포, 존속감금에 해당하는 구체적인 예시가 있을까요?","체포, 감금, 존속체포, 존속감금"
860,"중체포, 중감금, 존속중체포, 존속중감금에 대한 처벌 수위는 어떻게 되나요?","중체포, 중감금, 존속중체포, 존속중감금"
861,"중체포, 중감금, 존속중체포, 존속중감금가 적용되는 조건은 무엇인가요?","중체포, 중감금, 존속중체포, 존속중감금"
862,"중체포, 중감금, 존속중체포, 존속중감금에 해당하는 구체적인 예시가 있을까요?","중체포, 중감금, 존속중체포, 존속중감금"
863,"피해자가 원하지 않아도 특수체포, 특수감금로 처벌되나요?","특수체포, 특수감금"
864,"특수체포, 특수감금에 대한 처벌 수위는 어떻게 되나요?","특수체포, 특수감금"
865,"특수체포, 특수감금는 실수로 해도 처벌되나요?","특수체포, 특수감금"
867,상습범에 대한 처벌 수위는 어떻게 되나요?,상습범
868,피해자가 원하지 않아도 상습범로 처벌되나요?,상습범
872,체포ㆍ감금등의 치사상에 대해 설명해 주세요.,체포ㆍ감금등의 치사상
873,피해자가 원하지 않아도 체포ㆍ감금등의 치사상로 처벌되나요?,체포ㆍ감금등의 치사상
874,체포ㆍ감금등의 치사상는 실수로 해도 처벌되나요?,체포ㆍ감금등의 치사상
877,자격정지의 병과는 실수로 해도 처벌되나요?,자격정지의 병과
878,"협박, 존속협박가 적용되는 조건은 무엇인가요?","협박, 존속협박"
879,"협박, 존속협박는 어떤 행위를 하면 성립하나요?","협박, 존속협박"
880,"협박, 존속협박에 대한 처벌 수위는 어떻게 되나요?","협박, 존속협박"
881,특수협박는 실수로 해도 처벌되나요?,특수협박
882,특수협박에 해당하는 구체적인 예시가 있을까요?,특수협박
883,특수협박가 적용되는 조건은 무엇인가요?,특수협박
890,"미성년자의 약취, 유인에 대해 설명해 주세요.","미성년자의 약취, 유인"
891,"미성년자의 약취, 유인에 대한 처벌 수위는 어떻게 되나요?","미성년자의 약취, 유인"
892,"미성년자의 약취, 유인는 실수로 해도 처벌되나요?","미성년자의 약취, 유인"
893,"추행 등 목적 약취, 유인 등는 실수로 해도 처벌되나요?","추행 등 목적 약취, 유인 등"
894,"추행 등 목적 약취, 유인 등에 해당하는 구체적인 예시가 있을까요?","추행 등 목적 약취, 유인 등"
895,"추행 등 목적 약취, 유인 등는 어떤 행위를 하면 성립하나요?","추행 등 목적 약취, 유인 등"
896,인신매매에 대한 처벌 수위는 어떻게 되나요?,인신매매
897,인신매매에 해당하는 구체적인 예시가 있을까요?,인신매매
898,인신매매는 실수로 해도 처벌되나요?,인신매매
899,"피해자가 원하지 않아도 약취, 유인, 매매, 이송 등 상해ㆍ치상로 처벌되나요?","약취, 유인, 매매, 이송 등 상해ㆍ치상"
900,"약취, 유인, 매매, 이송 등 상해ㆍ치상에 대해 설명해 주세요.","약취, 유인, 매매, 이송 등 상해ㆍ치상"
901,"약취, 유인, 매매, 이송 등 상해ㆍ치상에 대한 처벌 수위는 어떻게 되나요?","약취, 유인, 매매, 이송 등 상해ㆍ치상"
902,"약취, 유인, 매매, 이송 등 살인ㆍ치사에 대한 처벌 수위는 어떻게 되나요?","약취, 유인, 매매, 이송 등 살인ㆍ치사"
903,"약취, 유인, 매매, 이송 등 살인ㆍ치사에 대해 설명해 주세요.","약취, 유인, 매매, 이송 등 살인ㆍ치사"
904,"약취, 유인, 매매, 이송 등 살인ㆍ치사가 적용되는 조건은 무엇인가요?","약취, 유인, 매매, 이송 등 살인ㆍ치사"
