,question,label
905,"약취, 유인, 매매, 이송된 사람의 수수ㆍ은닉 등는 어떤 행위를 하면 성립하나요?","약취, 유인, 매매, 이송된 사람의 수수ㆍ은닉 등"
906,"약취, 유인, 매매, 이송된 사람의 수수ㆍ은닉 등가 성립하지 않는 경우도 있나요?","약취, 유인, 매매, 이송된 사람의 수수ㆍ은닉 등"
907,"약취, 유인, 매매, 이송된 사람의 수수ㆍ은닉 등에 대한 처벌 수위는 어떻게 되나요?","약취, 유인, 매매, 이송된 사람의 수수ㆍ은닉 등"
911,벌금의 병과가 성립하지 않는 경우도 있나요?,벌금의 병과
912,벌금의 병과에 해당하는 구체적인 예시가 있을까요?,벌금의 병과
917,강간에 대한 처벌 수위는 어떻게 되나요?,강간
918,강간는 어떤 행위를 하면 성립하나요?,강간
919,강간가 적용되는 조건은 무엇인가요?,강간
920,강제추행는 어떤 행위를 하면 성립하나요?,강제추행
921,강제추행가 성립하지 않는 경우도 있나요?,강제추행
922,강제추행에 대한 처벌 수위는 어떻게 되나요?,강제추행
923,"준강간, 준강제추행에 해당하는 구체적인 예시가 있을까요?","준강간, 준강제추행"
924,"준강간, 준강제추행는 실수로 해도 처벌되나요?","준강간, 준강제추행"
925,"준강간, 준강제추행는 어떤 행위를 하면 성립하나요?","준강간, 준강제추행"
929,강간 등 상해ㆍ치상가 성립하지 않는 경우도 있나요?,강간 등 상해ㆍ치상
930,강간 등 상해ㆍ치상가 적용되는 조건은 무엇인가요?,강간 등 상해ㆍ치상
931,강간 등 상해ㆍ치상에 대해 설명해 주세요.,강간 등 상해ㆍ치상
932,미성년자 등에 대한 간음가 성립하지 않는 경우도 있나요?,미성년자 등에 대한 간음
933,미성년자 등에 대한 간음가 적용되는 조건은 무엇인가요?,미성년자 등에 대한 간음
934,피해자가 원하지 않아도 미성년자 등에 대한 간음로 처벌되나요?,미성년자 등에 대한 간음
935,업무상위력 등에 의한 간음는 어떤 행위를 하면 성립하나요?,업무상위력 등에 의한 간음
936,업무상위력 등에 의한 간음는 실수로 해도 처벌되나요?,업무상위력 등에 의한 간음
937,업무상위력 등에 의한 간음에 해당하는 구체적인 예시가 있을까요?,업무상위력 등에 의한 간음
938,"미성년자에 대한 간음, 추행가 적용되는 조건은 무엇인가요?","미성년자에 대한 간음, 추행"
939,"미성년자에 대한 간음, 추행에 대해 설명해 주세요.","미성년자에 대한 간음, 추행"
940,"미성년자에 대한 간음, 추행는 실수로 해도 처벌되나요?","미성년자에 대한 간음, 추행"
941,명예훼손는 실수로 해도 처벌되나요?,명예훼손
942,피해자가 원하지 않아도 명예훼손로 처벌되나요?,명예훼손
943,명예훼손가 성립하지 않는 경우도 있나요?,명예훼손
944,사자의 명예훼손가 적용되는 조건은 무엇인가요?,사자의 명예훼손
945,사자의 명예훼손에 해당하는 구체적인 예시가 있을까요?,사자의 명예훼손
946,사자의 명예훼손에 대해 설명해 주세요.,사자의 명예훼손
947,출판물 등에 의한 명예훼손가 적용되는 조건은 무엇인가요?,출판물 등에 의한 명예훼손
948,피해자가 원하지 않아도 출판물 등에 의한 명예훼손로 처벌되나요?,출판물 등에 의한 명예훼손
949,출판물 등에 의한 명예훼손에 대해 설명해 주세요.,출판물 등에 의한 명예훼손
950,위법성의 조각에 대한 처벌 수위는 어떻게 되나요?,위법성의 조각
951,위법성의 조각가 적용되는 조건은 무엇인가요?,위법성의 조각
952,위법성의 조각는 어떤 행위를 하면 성립하나요?,위법성의 조각
953,모욕가 적용되는 조건은 무엇인가요?,모욕
954,피해자가 원하지 않아도 모욕로 처벌되나요?,모욕
955,모욕에 대한 처벌 수위는 어떻게 되나요?,모욕
956,고소와 피해자의 의사가 적용되는 조건은 무엇인가요?,고소와 피해자의 의사
957,고소와 피해자의 의사에 대한 처벌 수위는 어떻게 되나요?,고소와 피해자의 의사
958,고소와 피해자의 의사에 대해 설명해 주세요.,고소와 피해자의 의사
959,피해자가 원하지 않아도 신용훼손로 처벌되나요?,신용훼손
960,신용훼손에 해당하는 구체적인 예시가 있을까요?,신용훼손
961,신용훼손가 적용되는 조건은 무엇인가요?,신용훼손
962,업무방해는 실수로 해도 처벌되나요?,업무방해
963,피해자가 원하지 않아도 업무방해로 처벌되나요?,업무방해
964,업무방해에 대한 처벌 수위는 어떻게 되나요?,업무방해
965,"경매, 입찰의 방해는 어떤 행위를 하면 성립하나요?","경매, 입찰의 방해"
966,"경매, 입찰의 방해에 대한 처벌 수위는 어떻게 되나요?","경매, 입찰의 방해"
967,"경매, 입찰의 방해에 대해 설명해 주세요.","경매, 입찰의 방해"
968,비밀침해가 성립하지 않는 경우도 있나요?,비밀침해
969,비밀침해는 실수로 해도 처벌되나요?,비밀침해
970,비밀침해에 대한 처벌 수위는 어떻게 되나요?,비밀침해
971,업무상비밀누설가 성립하지 않는 경우도 있나요?,업무상비밀누설
972,피해자가 원하지 않아도 업무상비밀누설로 처벌되나요?,업무상비밀누설
973,업무상비밀누설는 어떤 행위를 하면 성립하나요?,업무상비밀누설
974,고소가 적용되는 조건은 무엇인가요?,고소
975,고소는 어떤 행위를 하면 성립하나요?,고소
976,고소에 해당하는 구체적인 예시가 있을까요?,고소
977,"주거침입, 퇴거불응에 해당하는 구체적인 예시가 있을까요?","주거침입, 퇴거불응"
978,"주거침입, 퇴거불응가 적용되는 조건은 무엇인가요?","주거침입, 퇴거불응"
979,"주거침입, 퇴거불응는 어떤 행위를 하면 성립하나요?","주거침입, 퇴거불응"
980,특수주거침입는 어떤 행위를 하면 성립하나요?,특수주거침입
981,특수주거침입는 실수로 해도 처벌되나요?,특수주거침입
982,특수주거침입가 적용되는 조건은 무엇인가요?,특수주거침입
983,주거ㆍ신체 수색가 적용되는 조건은 무엇인가요?,주거ㆍ신체 수색
984,주거ㆍ신체 수색에 대해 설명해 주세요.,주거ㆍ신체 수색
985,주거ㆍ신체 수색는 실수로 해도 처벌되나요?,주거ㆍ신체 수색
989,권리행사방해는 어떤 행위를 하면 성립하나요?,권리행사방해
990,피해자가 원하지 않아도 권리행사방해로 처벌되나요?,권리행사방해
991,권리행사방해가 적용되는 조건은 무엇인가요?,권리행사방해
992,강요는 실수로 해도 처벌되나요?,강요
993,강요에 대해 설명해 주세요.,강요
994,강요는 어떤 행위를 하면 성립하나요?,강요
995,"피해자가 원하지 않아도 점유강취, 준점유강취로 처벌되나요?","점유강취, 준점유강취"
996,"점유강취, 준점유강취가 성립하지 않는 경우도 있나요?","점유강취, 준점유강취"
997,"점유강취, 준점유강취에 대한 처벌 수위는 어떻게 되나요?","점유강취, 준점유강취"
998,중권리행사방해에 해당하는 구체적인 예시가 있을까요?,중권리행사방해
999,피해자가 원하지 않아도 중권리행사방해로 처벌되나요?,중권리행사방해
1000,중권리행사방해에 대한 처벌 수위는 어떻게 되나요?,중권리행사방해
1001,강제집행면탈는 어떤 행위를 하면 성립하나요?,강제집행면탈
1002,강제집행면탈가 성립하지 않는 경우도 있나요?,강제집행면탈
1003,피해자가 원하지 않아도 강제집행면탈로 처벌되나요?,강제집행면탈
1004,친족간의 범행과 고소가 적용되는 조건은 무엇인가요?,친족간의 범행과 고소
1005,친족간의 범행과 고소는 어떤 행위를 하면 성립하나요?,친족간의 범행과 고소
1006,친족간의 범행과 고소는 실수로 해도 처벌되나요?,친족간의 범행과 고소
1007,피해자가 원하지 않아도 절도로 처벌되나요?,절도
1008,절도에 대한 처벌 수위는 어떻게 되나요?,절도
1009,절도가 성립하지 않는 경우도 있나요?,절도
1010,야간주거침입절도가 성립하지 않는 경우도 있나요?,야간주거침입절도
1011,야간주거침입절도는 어떤 행위를 하면 성립하나요?,야간주거침입절도
1012,야간주거침입절도는 실수로 해도 처벌되나요?,야간주거침입절도
1013,특수절도에 대해 설명해 주세요.,특수절도
1014,피해자가 원하지 않아도 특수절도로 처벌되나요?,특수절도
1015,특수절도에 대한 처벌 수위는 어떻게 되나요?,특수절도
1019,강도가 적용되는 조건은 무엇인가요?,강도
1020,강도가 성립하지 않는 경우도 있나요?,강도
1021,피해자가 원하지 않아도 강도로 처벌되나요?,강도
1022,특수강도는 어떤 행위를 하면 성립하나요?,특수강도
1023,특수강도에 대한 처벌 수위는 어떻게 되나요?,특수강도
1024,피해자가 원하지 않아도 특수강도로 처벌되나요?,특수강도
1025,피해자가 원하지 않아도 준강도로 처벌되나요?,준강도
1026,준강도에 해당하는 구체적인 예시가 있을까요?,준강도
1027,준강도는 실수로 해도 처벌되나요?,준강도
1028,인질강도에 대해 설명해 주세요.,인질강도
1029,인질강도에 대한 처벌 수위는 어떻게 되나요?,인질강도
1030,인질강도가 성립하지 않는 경우도 있나요?,인질강도
1031,"강도상해, 치상는 실수로 해도 처벌되나요?","강도상해, 치상"
1032,"강도상해, 치상에 대해 설명해 주세요.","강도상해, 치상"
1033,"강도상해, 치상는 어떤 행위를 하면 성립하나요?","강도상해, 치상"
1034,강도살인ㆍ치사에 해당하는 구체적인 예시가 있을까요?,강도살인ㆍ치사
1035,강도살인ㆍ치사가 적용되는 조건은 무엇인가요?,강도살인ㆍ치사
1036,강도살인ㆍ치사는 실수로 해도 처벌되나요?,강도살인ㆍ치사
1037,강도강간에 대해 설명해 주세요.,강도강간
1038,강도강간에 대한 처벌 수위는 어떻게 되나요?,강도강간
1039,강도강간가 성립하지 않는 경우도 있나요?,강도강간
1040,해상강도가 적용되는 조건은 무엇인가요?,해상강도
1041,해상강도에 대한 처벌 수위는 어떻게 되나요?,해상강도
1042,해상강도에 해당하는 구체적인 예시가 있을까요?,해상강도
1052,친족간의 범행에 해당하는 구체적인 예시가 있을까요?,친족간의 범행
1053,친족간의 범행는 실수로 해도 처벌되나요?,친족간의 범행
1054,피해자가 원하지 않아도 친족간의 범행로 처벌되나요?,친족간의 범행
1055,자격정지의 병과에 대한 처벌 수위는 어떻게 되나요?,자격정지의 병과
1058,동력가 성립하지 않는 경우도 있나요?,동력
1059,동력는 실수로 해도 처벌되나요?,동력
1060,동력는 어떤 행위를 하면 성립하나요?,동력
1061,피해자가 원하지 않아도 사기로 처벌되나요?,사기
1062,사기가 적용되는 조건은 무엇인가요?,사기
1063,사기는 실수로 해도 처벌되나요?,사기
1064,준사기에 대해 설명해 주세요.,준사기
1065,준사기에 해당하는 구체적인 예시가 있을까요?,준사기
1066,준사기가 성립하지 않는 경우도 있나요?,준사기
1067,부당이득에 해당하는 구체적인 예시가 있을까요?,부당이득
1068,부당이득가 성립하지 않는 경우도 있나요?,부당이득
1069,부당이득에 대한 처벌 수위는 어떻게 되나요?,부당이득
1070,피해자가 원하지 않아도 공갈로 처벌되나요?,공갈
1071,공갈에 대한 처벌 수위는 어떻게 되나요?,공갈
1072,공갈는 실수로 해도 처벌되나요?,공갈
1073,상습범에 대해 설명해 주세요.,상습범
1082,"친족간의 범행, 동력가 성립하지 않는 경우도 있나요?","친족간의 범행, 동력"
1083,"친족간의 범행, 동력에 해당하는 구체적인 예시가 있을까요?","친족간의 범행, 동력"
1084,"친족간의 범행, 동력가 적용되는 조건은 무엇인가요?","친족간의 범행, 동력"
1085,"횡령, 배임는 실수로 해도 처벌되나요?","횡령, 배임"
1086,"횡령, 배임가 적용되는 조건은 무엇인가요?","횡령, 배임"
1087,"횡령, 배임가 성립하지 않는 경우도 있나요?","횡령, 배임"
1088,업무상의 횡령과 배임에 대한 처벌 수위는 어떻게 되나요?,업무상의 횡령과 배임
1089,업무상의 횡령과 배임는 실수로 해도 처벌되나요?,업무상의 횡령과 배임
1090,업무상의 횡령과 배임가 적용되는 조건은 무엇인가요?,업무상의 횡령과 배임
1091,배임수증재가 적용되는 조건은 무엇인가요?,배임수증재
1092,피해자가 원하지 않아도 배임수증재로 처벌되나요?,배임수증재
1093,배임수증재는 실수로 해도 처벌되나요?,배임수증재
1095,자격정지의 병과에 대해 설명해 주세요.,자격정지의 병과
1100,점유이탈물횡령에 대한 처벌 수위는 어떻게 되나요?,점유이탈물횡령
1101,점유이탈물횡령에 대해 설명해 주세요.,점유이탈물횡령
1102,점유이탈물횡령는 실수로 해도 처벌되나요?,점유이탈물횡령
1103,"친족간의 범행, 동력에 대한 처벌 수위는 어떻게 되나요?","친족간의 범행, 동력"
1104,"친족간의 범행, 동력는 실수로 해도 처벌되나요?","친족간의 범행, 동력"
1106,"장물의 취득, 알선 등에 대한 처벌 수위는 어떻게 되나요?","장물의 취득, 알선 등"
1107,"장물의 취득, 알선 등에 해당하는 구체적인 예시가 있을까요?","장물의 취득, 알선 등"
1108,"장물의 취득, 알선 등가 적용되는 조건은 무엇인가요?","장물의 취득, 알선 등"
1112,"업무상과실, 중과실가 성립하지 않는 경우도 있나요?","업무상과실, 중과실"
1113,"업무상과실, 중과실에 대해 설명해 주세요.","업무상과실, 중과실"
1114,"업무상과실, 중과실에 대한 처벌 수위는 어떻게 되나요?","업무상과실, 중과실"
1115,친족간의 범행에 대해 설명해 주세요.,친족간의 범행
1116,친족간의 범행가 적용되는 조건은 무엇인가요?,친족간의 범행
1117,친족간의 범행에 대한 처벌 수위는 어떻게 되나요?,친족간의 범행
1118,재물손괴등에 해당하는 구체적인 예시가 있을까요?,재물손괴등
1119,재물손괴등는 실수로 해도 처벌되나요?,재물손괴등
1120,재물손괴등가 적용되는 조건은 무엇인가요?,재물손괴등
1121,공익건조물파괴가 성립하지 않는 경우도 있나요?,공익건조물파괴
1122,공익건조물파괴는 어떤 행위를 하면 성립하나요?,공익건조물파괴
1123,피해자가 원하지 않아도 공익건조물파괴로 처벌되나요?,공익건조물파괴
1124,피해자가 원하지 않아도 중손괴로 처벌되나요?,중손괴
1125,중손괴에 대한 처벌 수위는 어떻게 되나요?,중손괴
1126,중손괴가 성립하지 않는 경우도 있나요?,중손괴
1127,피해자가 원하지 않아도 특수손괴로 처벌되나요?,특수손괴
1128,특수손괴에 대한 처벌 수위는 어떻게 되나요?,특수손괴
1129,특수손괴가 적용되는 조건은 무엇인가요?,특수손괴
1130,경계침범가 성립하지 않는 경우도 있나요?,경계침범
1131,경계침범가 적용되는 조건은 무엇인가요?,경계침범
1132,경계침범에 대해 설명해 주세요.,경계침범
1136,동력에 대한 처벌 수위는 어떻게 되나요?,동력
1137,피해자가 원하지 않아도 동력로 처벌되나요?,동력
